{
  "schema": "lowlat-report/1",
  "example": "04-benchmark-harnesses",
  "language": "python",
  "variant": "check_digit-warmup",
  "unit": "ns",
  "count": 31,
  "dropped": 0,
  "percentiles": {
    "p50": 1963,
    "p90": 2026,
    "p99": 2045,
    "p99_9": 2045,
    "max": 2045
  },
  "hdr_histogram": "HISTFAAAAE14nJNpmSzMwMBgzAABzFCakYGB2c1gxwIG+w8QgaOyTKxM1kxM/EyCTEwsrEzMTIxMTEzMTCCKlUmUiZEJJMbEzGQKEuIFqQIAhP4GhQ==",
  "build": {
    "compiler": "3.14.8 (main, Oct  1 2026, 00:00:00) [GCC 16.2.1 20260819 (Red Hat 16.2.1-2)]",
    "gil_enabled": true
  },
  "profile": {
    "schema": "lowlat-profile/1",
    "captured_at": "2026-10-22T02:25:29Z",
    "host_label": "bare-metal-host",
    "cpu": {
      "model": "11th Gen Intel(R) Core(TM) i7-11800H @ 2.30GHz",
      "sockets": 1,
      "cores_per_socket": 8,
      "threads_per_core": 2,
      "logical_cpus": 16,
      "smt_active": true,
      "online": "0-15"
    },
    "power": {
      "scaling_driver": "intel_pstate",
      "governor": "powersave",
      "energy_performance_preference": "balance_performance",
      "intel_pstate_no_turbo": false,
      "cpufreq_boost": null,
      "cpu0_min_khz": 800000,
      "cpu0_max_khz": 4600000
    },
    "tuned": "balanced",
    "kernel": {
      "release": "7.2.11-200.fc44.x86_64",
      "version": "#1 SMP PREEMPT_DYNAMIC Thu Oct 15 15:58:58 UTC 2026",
      "preempt_model": "PREEMPT_DYNAMIC",
      "realtime": false,
      "sys_kernel_realtime": null,
      "cmdline": null,
      "isolcpus": null,
      "nohz_full": null,
      "rcu_nocbs": null,
      "irqaffinity": null,
      "sys_isolated": null,
      "sys_nohz_full": null
    },
    "clock": {
      "current_clocksource": "tsc",
      "available_clocksource": [
        "tsc",
        "acpi_pm"
      ]
    },
    "process": {
      "pid": 1846715,
      "cpu_affinity": "0-15",
      "sched_policy": "SCHED_OTHER"
    },
    "virt": {
      "type": "none",
      "product_name": "XPS 15 9510"
    },
    "load": {
      "load1": 0.27,
      "load5": 0.41,
      "load15": 0.26,
      "running": 2
    },
    "memory": {
      "mem_total_kb": 65545544,
      "hugepages_total": 0,
      "hugepages_free": 0,
      "hugepagesize_kb": 2048,
      "transparent_hugepage": "madvise"
    },
    "lab": {
      "running_domains": []
    },
    "tools": {
      "gcc": "gcc (GCC) 16.2.1 20260819 (Red Hat 16.2.1-2)",
      "clang": "clang version 22.1.8 (Fedora 22.1.8-4.fc44)",
      "java": "openjdk version \"25.0.3\" 2026-04-21 LTS",
      "python3": "Python 3.14.8",
      "cmake": "cmake version 4.3.0"
    }
  },
  "notes": "pyperf warm-up values (not in the result) from 7 runs; each value is the time per check digit, rounded to whole ns."
}
