{
  "schema" : "lowlat-report/1",
  "example" : "03-coordinated-omission",
  "language" : "java",
  "variant" : "closed-loop-corrected",
  "unit" : "ns",
  "count" : 10199,
  "dropped" : 0,
  "percentiles" : {
    "p50" : 807,
    "p90" : 3661,
    "p99" : 99155967,
    "p99_9" : 190185471,
    "max" : 200146943
  },
  "hdr_histogram" : "HISTFAAABmZ4nK1WTYhcRRDuV69eT0/Pm7cvs3FYx3Vd1nVZ4iohLjGaGH+QNUTRZZEomoNI0CCSk6DnIHgQg6CgJw0oePHiTYMHL4IgIl48CZ4UxIviyZvfV9XjT1BRcX7e65+q6qrq76vu5edfWQxh/FTwT13eFZo7B9+/GG7/wQd+riQtn3q7emzvxJHZSre1ffrhvUNbW2sHZpNpmrTTadSUYk7axS7FlPNENanGGDQoP4FdjSoqWYKKBNGAB36pFklRICMN5rWGFCYiHxCMNDBAK+I5kgYqMCs1Vf1PW+OoQ+9yKnCJOIBwrY3WeIfIJ2Wg2JTnEIJXCIwuuiIGZMxGkDH8NQe4ttDXVNxtrCe+EPwb2Po6EhqtlXEhgMa6pjp2RxXL19ZgWNGU6alpWbR0VNVWswFqMGVmtKZwql3Fw1SboEXYqpM5JcgeB+k8jCFR2BVJHfPbYadm60vHb9z9sDpzUR6/IF9Vb8jLcqG6JM99JK9X56svq9OX5Mir1V2731YHzlfbu3uH95af2Dy5ub6zenJ9dWf56X53tnVu9Y6lgxtbZ1Z2t3fuP/DIyrvV4Z2z259UR57ZOHG+OnZu89SxE6fWzh568ODGrdO796+vrh2aHJ4tHZ+stsuTlRVZ6WeTbpbX8rTvVrs+t303TWnadnmqy3233G/Erp902uU861qZdn3f9m3OqZO1OGvbKEua27Rfe22zTmIrsY2T2CHO1Evcn3LUnJK2AaBrMZ0VGZiGmCcxJMlBO2m1FZ0CdxnSUQCpmAIwnDQj/1DOwLNGaWXCSaAhxQ4okDYmbA4ymzUjzwlzGEEbqoZVwweGQiaIgQbJHOe+BC6vfKlBiiCEQuAQRZMhi97QDoa4vXUyO9z4RFTQjs7ByaWAKk0GKsjAY5qiTXiP/Vd2bTlSCVADVNQ/QdwOAzBOukZt8lTPNZVorjFGgcXCTCAa+AnEacpEL5UbroQ5FAGjOaFnwTDEAbFueaTBwgGDcWau2PU/M5M4DadisvQZGTQ7J2jR0uxNekOCGGvoPWUyEhnNBtmAysQkcR+kaGWJDRPMIWy6hHZOKrqHmdTYpG3RgOEwGZzHyJAVzSwxc/tMr9FSd3yBmrumFOZIbVtX/jZaqG8eNuSoa8sCFhtZpmQYF6k8ZD1if8EskdQRJc3KULACOhJbAKUmWLkZ4lv7OHVZMml77JWmMalrWeCwltjbKp4Vq7EusDlAyRq5icZeQ2ZiUbz2eA0cenWuzeaCQhkiV9IXmtjn8yzATMKiumQwVYw1Vgm9cBJ1g3Ik1NywIkhJ9bi8TBpANRTRhuyxhDu2PRuRx4Q4uHJj8DepqFJin6OoKTO2k7bDCWAGbDIqSyRdY0ot6A1m9ygvHWDRZhJflAKZi+CdiNIW/Zx53EUeglYFkrEEWKMp+hgdpiwdmBQnJw9FRhXxQfBRzKCi9GjbFdZGPzlpRGlP0wTORXpI/RbCJIu2fbZBOgWLPVsWpee5y/QIC/dQ6kkjeIBKqS0ch/eSjLBkHgY6LqS2CldPDWbVaAXfE6mifsySskaVwhB6aamNlGOh4JHO9AYjcx3nWxit0IjRkLa8hrmBYAiZEwcYjM6XEA2r9LQc/1ixsYaSmSxGYgfjYH4ZMPnaoVcKjWHBppRXjtrPfOsbidgbYjPrXBTVWFU6Ese2MSQi7xcDQ/sCbxvWGokhbUCeG2uVko065JkpoyocGRsAHO7029jh8Ne5T6idv90ygs/VBe61FO6OpdyFSDOvKGapmV+R6jl7ze8BQ65pzq8Qwcs+te0I4pGDUIy9vDkFu2M0zALTpVSHV7n2K4+T0C2VK4ldcFhMPTaKhxKSj9p1asAKbnXJXVa/UtmpaijimVqOJvHS7Hcal6YjPHuDH0YMiHdHENkYZ4dMIn9qWxLgp19mBEU/NqYlxCGhaCKpxEGHE1NtN9P51qkByI8RXs9SYwC3XSFNLPklYGlSqZVNwXjDAOawtgTabskcgfPNGtrGjVm/Mb6IanqdbeBNcoPcBpxdI+9U8gCS932F9qPyQgXJe+Vm+a6Sj0XeayD5LLp3ykuVfFbJW5U8KffI9fLiWL6+T95ckC8G8vlAXlP5pi6/D0R+rOSnis/f/z6tYOrvvw/JLXL01//RP/T+6f9qucq+/+39f2nxLBxd9ry8/+ej/7b/11K/ADiOjT0=",
  "build" : {
    "compiler" : "OpenJDK 25.0.3+9-LTS (OpenJDK 64-Bit Server VM)",
    "gil_enabled" : null
  },
  "profile" : {
    "schema" : "lowlat-profile/1",
    "captured_at" : "2026-10-22T14:48:35Z",
    "host_label" : "bare-metal-host",
    "cpu" : {
      "model" : "11th Gen Intel(R) Core(TM) i7-11800H @ 2.30GHz",
      "sockets" : 1,
      "cores_per_socket" : 8,
      "threads_per_core" : 2,
      "logical_cpus" : 16,
      "smt_active" : true,
      "online" : "0-15"
    },
    "power" : {
      "scaling_driver" : "intel_pstate",
      "governor" : "powersave",
      "energy_performance_preference" : "balance_performance",
      "intel_pstate_no_turbo" : false,
      "cpufreq_boost" : null,
      "cpu0_min_khz" : 800000,
      "cpu0_max_khz" : 4600000
    },
    "tuned" : "balanced",
    "kernel" : {
      "release" : "7.2.11-200.fc44.x86_64",
      "version" : "#1 SMP PREEMPT_DYNAMIC Thu Oct 15 15:58:58 UTC 2026",
      "preempt_model" : "PREEMPT_DYNAMIC",
      "realtime" : false,
      "sys_kernel_realtime" : null,
      "cmdline" : null,
      "isolcpus" : null,
      "nohz_full" : null,
      "rcu_nocbs" : null,
      "irqaffinity" : null,
      "sys_isolated" : null,
      "sys_nohz_full" : null
    },
    "clock" : {
      "current_clocksource" : "tsc",
      "available_clocksource" : [ "tsc", "acpi_pm" ]
    },
    "process" : {
      "pid" : 2075506,
      "cpu_affinity" : "0-15",
      "sched_policy" : "SCHED_OTHER"
    },
    "virt" : {
      "type" : "none",
      "product_name" : "XPS 15 9510"
    },
    "load" : {
      "load1" : 0.9,
      "load5" : 1.03,
      "load15" : 1.15,
      "running" : 1
    },
    "memory" : {
      "mem_total_kb" : 65545544,
      "hugepages_total" : 0,
      "hugepages_free" : 0,
      "hugepagesize_kb" : 2048,
      "transparent_hugepage" : "madvise"
    },
    "lab" : {
      "running_domains" : [ ]
    },
    "tools" : {
      "gcc" : "gcc (GCC) 16.2.1 20260819 (Red Hat 16.2.1-2)",
      "clang" : "clang version 22.1.8 (Fedora 22.1.8-4.fc44)",
      "java" : "openjdk version \"25.0.3\" 2026-04-21 LTS",
      "python3" : "Python 3.14.8",
      "cmake" : "cmake version 4.3.0"
    }
  },
  "notes" : "stall_ms=200 stall_seq=5000 dropped=0; the stall is a blocking sleep; JIT not warmed; recordCorrected, expected interval 1 ms"
}
