{
  "build": {
    "compiler": "clang 22.1.8 (Fedora 22.1.8-4.fc44) (C++ __cplusplus=202302)",
    "flags": "Release: -O2 -g -fno-omit-frame-pointer -DNDEBUG",
    "gil_enabled": null
  },
  "count": 10000,
  "dropped": 0,
  "example": "02-littles-amdahl",
  "hdr_histogram": "HISTFAAACHd4nE1YO65kWRHsjBM3K1++8+673T1NG8NozNZYjIOFgYHE2BizAAyEgccWgBUgLAzwWAAOm2EBCCGxBBSRVS368+pV1bn5i8zIzPPD3//x/Zs37/71Zv6s+2u8ebN+/u0//vrmp/+dD/75W/wt8O/AnwOv+CU+4Vf4Eh9w4Bv+DE9Y+B4Hfo1P+BHe4ns84xlf44Y/BD4AH/AVnnEAeMErnnHDDa848BF4RgAHbv7uLW4IfMgDL3gCAi/+wVcEAwci9V7//JJYwBP0DYH0w+FvsfSGetVfLsLP3PQEQL3o68CTzdJTh4XzoYELDCyEH1l3lf6I4YMcn24+BI5sIlKG+YyVybcR8yzpz2AwMrBI2ybJyQM5v0uxzjOIRMryIJojiyT8hUxOHTwmgMt+3P8skMfot3g6BrbeL6SCdNNb6aF+TuwoWUE+2RPUQebS0fFBcm5kPuIsV42dfvcTkpAHFWomgosWjYUcPKQATL0L3kPPpbMyBmCkRI1FGQOWfsuxOrnl4Zxl5sgFuTIG25HEQvRDJHAkjXnpRKXPUVJKPh0+E4NdVLTtAcoqJxZCnLIuJgGk0qEoIzjA6VROmuYgi0omikazQFazgpJBsjOZLPlBJMsP6wWM3TqfKdFZKfUh80ueUc6hBB5366cRSCsnU4ZRqrOQRYsoVEdJPJlyDokqP5hZ+gGbE53dWwqBRraQZCWae8voxAls+SbjIrOTZLHLMrOJ2lkBKyFPGyYbC22tEATO9lwCact5aZHdLEIuxUT6JFgBxUjebKBc7nIsmRVCc5OoZktmpuolc4Nb8VAQrVxiFBrGWaGIViS2w787aACSuxTZptwuyZda66u0CqZQk9/KJAWMskllM0bCWCkYl7MGHdVwjOR++ZjMijKiLcDZKNGCinHLYoc8BIcsVR0JwbZafz7ZPOlvB8lWHEKO8VQuDm464yjoWItTskr5U9I+yGS2c7bsFRDbOIipCDldW86ixItVNYgK4sk6JZVQyozKQgj+YG6ZoGjklnIos/WEkOqtzJRG1ZTiKseaNaWhwClMCwqTJDvei11Rga24u5C7aCOZPRTsnFT62yOXzz1kLmFh4wJQ9SYaEzP55g9d3q0EpapsatsCk8i9Q4nnaIqkyl5xdAg0BbO4caVhZncL90uI5q6iP6rurPPKVkpt4dYu0Kgzry1nc5/ZZw5/18Wd7H0v086TcV4qH0TvCpZT80qodGt38lQ+RLOVrQKTSsKNPndWX9V9dvHKVrlGk7tQ1YIae/dQT56Zu/PsrDZsKu7rdNrgVD62+GvzTBVHKruEa+531ejYubM7mS3+hqD7HKOsVisrmBXGfQpNVaosVIqF1BbzZKPrLJ4nuBuZl/l9pyGoVMVHb1eF00uonWiVcaN4bppYStirxnSone/VWVv8ZTuU7P42hMN50kXRrC0uEQvoZRcUjMlR/R+akUE6I6pO5JmxE9sqla4iylLHEWTZ7Ny7otMcS/Ggs9C5VT3s6TQXa7YEOsmgROktdAuxT0zwXY9pFkIhzP6CjBmdIf84zWhyP81jOoNUyYnGd172wCQzVCZedBHLsFOdUA0nWsUrWSqR3bVJrhpKUJotq1EHNZW5+mWiCquWwtX62ryqNqhEqlQ+mm15xzBb8YxsisOoyrdbpmrxeeTwetS0IA5t6oBL0J9le9JwIxTFiz063OTLLC+GFnfNGFMUK5iF4CZWLQwXDI/Zf4hE+WueW0rl89xXXir3SzXKPHftbJVA1I7Ka6v7s7o7+wtehXOrBNEhI68f5KVc7ILKp3adBfmf79i4SpWYsbsUKJVViQTTZO4sYZUBz53cegW7NWyUKlQ1sFOFLhDUI5o7Lpxd5W4Jy9pVtqrZ1wmjXuCu3BLHs8o1ozHGiVJAvRMk7canHqF2XD0dyWln9skvEtWn4yYGlGH3JBTzuGAVX5e0EGNRYVe/SRNPT+aGjrvknAXt3uu0kZ6V3ZXbjUQHxNmuA9FFZvFUW1L9XcmlNzLAleHcsWZ1Gk9h9bl15L13tIYimRXbiR5u3NLuMVRTHjc9H2pLECWV8zGm+AtY5YkyJ5c0grWbxqwPU7Ca9DQIxLBKoJedV9N2C+ztb8xAXihcXyqaxvQxT6DLPF6tE/exF1OPnnA9rrrj21eFNjziebL2XNOccTunyemoiscDj6MS1BSVqwbAkJTw0OFFYfg2ho0cExl3zFDmsVfjuhuDBKdXH8VY83jl/y016vKptFGdstIz22x29pUeLTzhe4Mom52WDW8imEB5JBBhB+uYVVB7zpyYNcuLluOrHcxzGJ/SWwY9NIjm261r5sNQMzebepxaojXTiccFvygW8qrqXXqwXyKz0DQlB4SbaNybh2DOsVAfm/XyPhPNgF8ajeBh3lunOpOjicw1w634dd2Dfo+lwsClsc3TtXDjZKuWpImNma0cjuUQBAapBzieW1VSs5xNYjh41ISeSzStWe1BkeCRWuMd2rjLtKSFWSlsoUXPdmVeXaP6Pu0qHbXjr1kE08t4YuVtHpml9LHDP3bLmO3Ni3rOPsubltDFOX5Tiisj877kOja+QuCafTlw8C5NS7v2VcfBq71lza7vFf6+k8Or+2PD5801+tnGmGsLnT0mtcmDt/ShO3k8jvJ5biqCx6R+PW5AHkduj99jFlaJfNJdw5rv8zYeAU8Z2uaDvrzRpQRvjs0zbjx0LYEb306ID9/AvOcdBzsqJc9za7KALyFMb8TL1NDTw6SbPXua/d15weP+zPp8mSLP8jZ3NONjjNUvnEuNj+CLr4J8IWEQdBUkna/4ek7gLV648MKv8BHv8RFv8VGadJv0ivf4Bs/4XfhC6sf4C/AJ3+E/gZ/gT4r+l/gNvvPN1S+w8PfA/wBbeWpA",
  "language": "cpp",
  "model": {
    "L_sampled_time_average": 1.0866314425281627,
    "W_mean_seconds_modelling_input": 0.0010832176201,
    "lambda_per_s": 1000.0,
    "law": "Little: L = lambda * W",
    "max_in_system": 11,
    "offered_utilisation": 0.6,
    "predicted_L": 1.0832176201000001,
    "relative_error": 0.003151557327739384,
    "sample_interval_us": 997,
    "samples": 10031,
    "service_mean_us": 600.0,
    "warehouse": {
      "belt_metres_in_budget": 1.2,
      "belt_mps": 2.5,
      "in_flight_parcels": 480.0,
      "scan_to_divert_budget_ms": 480.0
    }
  },
  "notes": "received=10000 dropped=0 seed=7; W recorded per parcel as done - intended emit time",
  "percentiles": {
    "max": 10985471,
    "p50": 801279,
    "p90": 2238463,
    "p99": 4423679,
    "p99_9": 8503295
  },
  "profile": {
    "captured_at": "2026-10-23T06:34:07Z",
    "clock": {
      "available_clocksource": [
        "tsc",
        "acpi_pm"
      ],
      "current_clocksource": "tsc"
    },
    "cpu": {
      "cores_per_socket": 8,
      "logical_cpus": 16,
      "model": "11th Gen Intel(R) Core(TM) i7-11800H @ 2.30GHz",
      "online": "0-15",
      "smt_active": true,
      "sockets": 1,
      "threads_per_core": 2
    },
    "host_label": "bare-metal-host",
    "kernel": {
      "cmdline": null,
      "irqaffinity": null,
      "isolcpus": null,
      "nohz_full": null,
      "preempt_model": "PREEMPT_DYNAMIC",
      "rcu_nocbs": null,
      "realtime": false,
      "release": "7.2.11-200.fc44.x86_64",
      "sys_isolated": null,
      "sys_kernel_realtime": null,
      "sys_nohz_full": null,
      "version": "#1 SMP PREEMPT_DYNAMIC Thu Oct 15 15:58:58 UTC 2026"
    },
    "lab": {
      "running_domains": []
    },
    "load": {
      "load1": 0.39,
      "load15": 0.76,
      "load5": 0.73,
      "running": 1
    },
    "memory": {
      "hugepages_free": 0,
      "hugepages_total": 0,
      "hugepagesize_kb": 2048,
      "mem_total_kb": 65545544,
      "thp_defrag": "madvise",
      "thp_enabled": "madvise",
      "thp_shmem_enabled": "never",
      "transparent_hugepage": "madvise"
    },
    "power": {
      "cpu0_max_khz": 4600000,
      "cpu0_min_khz": 800000,
      "cpufreq_boost": null,
      "energy_performance_preference": "balance_performance",
      "governor": "powersave",
      "intel_pstate_no_turbo": false,
      "scaling_driver": "intel_pstate"
    },
    "process": {
      "cpu_affinity": "0-15",
      "pid": 2682900,
      "sched_policy": "SCHED_OTHER"
    },
    "schema": "lowlat-profile/1",
    "tools": {
      "clang": "clang version 22.1.8 (Fedora 22.1.8-4.fc44)",
      "cmake": "cmake version 4.3.0",
      "gcc": "gcc (GCC) 16.2.1 20260819 (Red Hat 16.2.1-2)",
      "java": "openjdk version \"25.0.5\" 2026-10-20 LTS",
      "java_full": "OpenJDK Runtime Environment Temurin-25.0.5+8 (build 25.0.5+8-LTS) | OpenJDK 64-Bit Server VM Temurin-25.0.5+8 (build 25.0.5+8-LTS, mixed mode, sharing)",
      "memlock_kb": "8192",
      "perf_event_paranoid": 2,
      "python3": "Python 3.14.8"
    },
    "tuned": "balanced",
    "virt": {
      "product_name": "XPS 15 9510",
      "type": "none"
    }
  },
  "schema": "lowlat-report/1",
  "unit": "ns",
  "variant": "littles-law"
}
