{
  "build": {
    "compiler": "clang 22.1.8 (Fedora 22.1.8-4.fc44) (C++ __cplusplus=202302)",
    "flags": "Release: -O2 -g -fno-omit-frame-pointer -DNDEBUG",
    "gil_enabled": null
  },
  "count": 5000,
  "dropped": 0,
  "example": "00-prerequisites",
  "hdr_histogram": "HISTFAAAAk14nC2SwW4TQQyG438cx5lOppPtdNlukyVapasoSqslpKWEihaEOCC4QA+AOMCFCxIHbnDmDXgBJF6C90EckXgENAm+ePSPZdmf/9HXb3udjrnd2Yb5n6nTMY/bn987l3+3wu8PwDOMMcAf4AAEgEDBW6deYgQLg5lgQOgB6G/eAzzAAXaxD+xw+jjFGMApuiD0U5ddHOMuDItjiGMWhaQgYSWwZTCYQCxCbCCpQkUBqFdhIHOiDFZhZeuct8FTKGLpLZxX55yws+qErXAQJ1VVPLl6+vLTl+uPb96/ff764vrR1aOL9eL8/mhVz+aTJlR1UzbVvJ409XQ2W87OV227XE4Xbb1+OJ9P1vVJc1Yv83KaV2WVhxDEheBC5jSk0YJVcILhmYnVsGdANhsIgUECYasMQIhTJQkBmuYXIHEUAqHLBixgIz30kJanDdM+H+IWCMOErw+DMQ4wxg0MMcQ9jPGLcBM9vMMRjmAwRA+H2F5mgG0HAPs82AhsON3LwPBOSmAYy1AlZgVEBaROo5fgvLPRZ8FlZagnPpYxdzG4WMZY5qEYjYo85mVTFnUeY1vnWd0WzWh1crE+a9r5fDVtF9Ors8WyLaerqpm05WSxOKmrahTLaTOvpmWZjfJY5CH44LIiSMyCDdF6X0SxPrho1Vsbgnp1bIN4Kx7QBDRdWFmTg1xyRxKSKYlZoJLsSWzYJvzKCbtggzPVMqXCXhKSq7eGI5D0Eo6NVQ02nu3yPpBOge5WhMEeMMAOLnEHx3iFH4LPeIEj/AMHGzc8",
  "language": "cpp",
  "notes": "reordered=0; rcvbuf_requested=4194304; rcvbuf_granted=8388608",
  "percentiles": {
    "max": 294911,
    "p50": 96063,
    "p90": 163967,
    "p99": 180095,
    "p99_9": 205055
  },
  "profile": {
    "captured_at": "2026-10-22T02:26:01Z",
    "clock": {
      "available_clocksource": [
        "tsc",
        "acpi_pm"
      ],
      "current_clocksource": "tsc"
    },
    "cpu": {
      "cores_per_socket": 8,
      "logical_cpus": 16,
      "model": "11th Gen Intel(R) Core(TM) i7-11800H @ 2.30GHz",
      "online": "0-15",
      "smt_active": true,
      "sockets": 1,
      "threads_per_core": 2
    },
    "host_label": "bare-metal-host",
    "kernel": {
      "cmdline": null,
      "irqaffinity": null,
      "isolcpus": null,
      "nohz_full": null,
      "preempt_model": "PREEMPT_DYNAMIC",
      "rcu_nocbs": null,
      "realtime": false,
      "release": "7.2.11-200.fc44.x86_64",
      "sys_isolated": null,
      "sys_kernel_realtime": null,
      "sys_nohz_full": null,
      "version": "#1 SMP PREEMPT_DYNAMIC Thu Oct 15 15:58:58 UTC 2026"
    },
    "lab": {
      "running_domains": []
    },
    "load": {
      "load1": 0.7,
      "load15": 0.29,
      "load5": 0.51,
      "running": 2
    },
    "memory": {
      "hugepages_free": 0,
      "hugepages_total": 0,
      "hugepagesize_kb": 2048,
      "mem_total_kb": 65545544,
      "transparent_hugepage": "madvise"
    },
    "power": {
      "cpu0_max_khz": 4600000,
      "cpu0_min_khz": 800000,
      "cpufreq_boost": null,
      "energy_performance_preference": "balance_performance",
      "governor": "powersave",
      "intel_pstate_no_turbo": false,
      "scaling_driver": "intel_pstate"
    },
    "process": {
      "cpu_affinity": "0-15",
      "pid": 1847834,
      "sched_policy": "SCHED_OTHER"
    },
    "schema": "lowlat-profile/1",
    "tools": {
      "clang": "clang version 22.1.8 (Fedora 22.1.8-4.fc44)",
      "cmake": "cmake version 4.3.0",
      "gcc": "gcc (GCC) 16.2.1 20260819 (Red Hat 16.2.1-2)",
      "java": "openjdk version \"25.0.3\" 2026-04-21 LTS",
      "python3": "Python 3.14.8"
    },
    "tuned": "balanced",
    "virt": {
      "product_name": "XPS 15 9510",
      "type": "none"
    }
  },
  "schema": "lowlat-report/1",
  "unit": "ns",
  "variant": "baseline"
}
