{
  "schema": "lowlat-report/1",
  "example": "10-lockfree-waitfree",
  "language": "cpp",
  "variant": "release-acquire",
  "unit": "ns",
  "count": 30,
  "dropped": 0,
  "percentiles": {
    "p50": 0,
    "p90": 0,
    "p99": 0,
    "p99_9": 0,
    "max": 0
  },
  "hdr_histogram": "HISTFAAAACN4nJNpmSzMwMDAyAABzFCakYGB2c1gxwIG+w8QARsAUuIEiA==",
  "build": {
    "compiler": "Google Benchmark v1.10.0; C++23 release preset (clang)",
    "gil_enabled": null,
    "flags": "library_build_type=release"
  },
  "profile": {
    "schema": "lowlat-profile/1",
    "captured_at": "2026-10-23T20:54:01Z",
    "host_label": "bare-metal-host",
    "cpu": {
      "vendor": "Intel",
      "model": "Intel 8-core/16-thread CPU",
      "sockets": 1,
      "cores_per_socket": 8,
      "threads_per_core": 2,
      "logical_cpus": 16,
      "smt_active": true,
      "online": "0-15",
      "caches": {
        "l1d": {
          "size_bytes": 49152,
          "line_bytes": 64
        },
        "l1i": {
          "size_bytes": 32768,
          "line_bytes": 64
        },
        "l2": {
          "size_bytes": 1310720,
          "line_bytes": 64
        },
        "l3": {
          "size_bytes": 25165824,
          "line_bytes": 64
        }
      },
      "topology": [
        {
          "cpu": 0,
          "core_id": 0,
          "package_id": 0
        },
        {
          "cpu": 1,
          "core_id": 1,
          "package_id": 0
        },
        {
          "cpu": 2,
          "core_id": 2,
          "package_id": 0
        },
        {
          "cpu": 3,
          "core_id": 3,
          "package_id": 0
        },
        {
          "cpu": 4,
          "core_id": 4,
          "package_id": 0
        },
        {
          "cpu": 5,
          "core_id": 5,
          "package_id": 0
        },
        {
          "cpu": 6,
          "core_id": 6,
          "package_id": 0
        },
        {
          "cpu": 7,
          "core_id": 7,
          "package_id": 0
        },
        {
          "cpu": 8,
          "core_id": 0,
          "package_id": 0
        },
        {
          "cpu": 9,
          "core_id": 1,
          "package_id": 0
        },
        {
          "cpu": 10,
          "core_id": 2,
          "package_id": 0
        },
        {
          "cpu": 11,
          "core_id": 3,
          "package_id": 0
        },
        {
          "cpu": 12,
          "core_id": 4,
          "package_id": 0
        },
        {
          "cpu": 13,
          "core_id": 5,
          "package_id": 0
        },
        {
          "cpu": 14,
          "core_id": 6,
          "package_id": 0
        },
        {
          "cpu": 15,
          "core_id": 7,
          "package_id": 0
        }
      ]
    },
    "power": {
      "scaling_driver": "intel_pstate",
      "governor": "powersave",
      "energy_performance_preference": "balance_performance",
      "intel_pstate_no_turbo": false,
      "cpufreq_boost": null,
      "cpu0_min_khz": 800000,
      "cpu0_max_khz": 4600000
    },
    "tuned": "balanced",
    "kernel": {
      "release": "7.2",
      "version": "PREEMPT_DYNAMIC",
      "preempt_model": "PREEMPT_DYNAMIC",
      "realtime": false,
      "sys_kernel_realtime": null,
      "cmdline": null,
      "isolcpus": null,
      "nohz_full": null,
      "rcu_nocbs": null,
      "irqaffinity": null,
      "sys_isolated": null,
      "sys_nohz_full": null
    },
    "clock": {
      "current_clocksource": "tsc",
      "available_clocksource": [
        "tsc",
        "acpi_pm"
      ]
    },
    "process": {
      "pid": 3740505,
      "cpu_affinity": "0-15",
      "sched_policy": "SCHED_OTHER"
    },
    "virt": {
      "type": "none"
    },
    "load": {
      "load1": 1.75,
      "load5": 2.13,
      "load15": 1.8,
      "running": 1
    },
    "memory": {
      "mem_total_kb": 65545544,
      "hugepages_total": 0,
      "hugepages_free": 0,
      "hugepagesize_kb": 2048,
      "transparent_hugepage": "madvise",
      "thp_enabled": "madvise",
      "thp_defrag": "madvise",
      "thp_shmem_enabled": "never"
    },
    "lab": {
      "running_domains": []
    },
    "tools": {
      "gcc": "gcc (GCC) 16.2.1 20260819 (Red Hat 16.2.1-2)",
      "clang": "clang version 22.1.8 (Fedora 22.1.8-4.fc44)",
      "java": "openjdk version \"25.0.5\" 2026-10-20 LTS",
      "java_full": "OpenJDK Runtime Environment Temurin-25.0.5+8 (build 25.0.5+8-LTS) | OpenJDK 64-Bit Server VM Temurin-25.0.5+8 (build 25.0.5+8-LTS, mixed mode, sharing)",
      "python3": "Python 3.14.8",
      "cmake": "cmake version 4.3.0",
      "perf": "7.2",
      "valgrind": "3.27.1",
      "perf_event_paranoid": 2,
      "memlock_kb": "8192"
    }
  },
  "notes": "Google Benchmark: 30 repetitions, one sample per repetition; each sample is a repetition's mean real time per iteration, taken over 1248535312 iterations, one iteration = 1 operation(s), rounded to whole ns. Per-iteration samples are not exposed by the harness."
}
