{
  "schema" : "lowlat-report/1",
  "example" : "12-io-engines",
  "language" : "java",
  "variant" : "client-lateness",
  "unit" : "ns",
  "count" : 25000,
  "dropped" : 0,
  "percentiles" : {
    "p50" : 123,
    "p90" : 210,
    "p99" : 12558335,
    "p99_9" : 21331967,
    "max" : 25804799
  },
  "hdr_histogram" : "HISTFAAABK14nI1VbYiUVRR+73PPfeedmd2dne91Hbdm23DUbddNWLHUFXWU1FoXw+3DqKUsLCIM+yAKyUz7EPthkSxl/QjtT/6QRS0MwqL9Y4RlUZFg/YskQkTCVHrufWd2ZmJXncv9OOc85znnnnvnvoXte9KeF53vhT9dmRWXK+Ye/dAb+DtU7FQ++POD1pZS993b1Kh6A/txGF/hCi7hC31Gn9Dn9V45q8/pXfKavCc/ysdyVk7IfrPLjJozcsj8ZM7LQbPXnDW/mCvmlNnuj7Ef9n83h/0L5qI55l805yzKHGcbM5fkL/lVvpYxMh7Su/Vn+hIuMOJBRj6K49iG3Wyj+EedUafUd+qYGlP72HeoF7arj9SLO9Tbasuzz9+35Z4Nj+9TTz/60PpHNqxZv2bJ0rvW3LZq4drla1ctXrFk4ZLF/f0LV8xePrfn1tKq0uyl3Td29/e0dxa6ewqdHV2lUq6nrbuzszS7vau90NXVkWrLlYL29tZCqaOQiWUyhbZURyrVlIulcplMKtPe4udaW3Jtba2ZjqacxDKpoCUWNPlNQWsQtIpQCGK++IEfNCGABOL7fhBDjOXlUkQ8q4APrjl6ErDsYjtFT6ig5DnRY4cW7VsR2mo915oR4RgqxEMcWTg5CiM0GXoR437OJwIHtm4cjEhEdKjybARqLKtFxkFvIYGRaBhTLMSTCBKULLeHJPssl0iWfQZ62TVuoHOCXgncjmFsRB9QxEpCihhg1DwhWdxEglswjZkWCVskGwnsxXRHNYw7sBUziZyDlxXuxDp8qXBZ4UFyFXEAuBlD2CwjTOMHMIP5BL+l6L0aZbIY6hfggCLNNGmWJO5nyDcVp+eYWpysecbpI241o01nHmVu5VOFk8C4siEH8a5ipCGqizhi5WF69Yn1ydPzJbyi8ADz2op/FS3jGn+Ae/oAeF0wHsG9dBnAMizCtwqbSHIZdNzETX6u8KriPK6kzMiDSDOjrfgTrNdpRY4+PIMjGr8pFjKJZfI9cNpyF12lBoUbnYGngBEOPyubyEmFJ/CJTXiOq+A7ily8CZstSZ5BEsxjGlcP26KksRPcQJYlmk6KsizAk+40PaLKHNfhG8WC8mh60SsJ7FFURrmZlSz1LI6DpJzJkxyR9xVLHbe1HbaJ8Nqx9coQxzJrXuQ+0/ageRvKTjeLGxlgPhGi5jOHULexorF+yyg/RvIovYYa7Hl77h5J05hHg73ZhhrtNDwZsfcq7e6Zk2nJs4KTy/MoWTnNVmPM1tlDuZFvan7LZyb8o+6G2apF2JIVuSKm3V4mMcfdzQ3NGq6a0QZ0aJ5A6/+ZNXXJutg1u7Zw+6duhEcdW3Yqc7w+tdDcgK6PZR+V5NRkVXOFjFIdl5NqWB52kiIX1mz3bDP1ZEKI82GSSEXfAKoTHMhUtmlfz0kdvKlBE+sqxj2K1E+Gr2QXgq7KGQ3rcV1x6zjdA15DNQj1oWvr8Cl3H4FEdR1eoapDAl6VaGJptVe3N1e+PaZyfSvgdBWargKTtUXlrqfdHFrs3Cw63IJ2n5RrTlGxf7pIOF4LbqrA64OHl0K0K6N2H7mEZGFbHtmJVr+uSQn8B4F7yjQ=",
  "build" : {
    "compiler" : "OpenJDK 25.0.5+8-LTS (OpenJDK 64-Bit Server VM)",
    "flags" : "-Xms256m -Xmx1g -XX:+ExitOnOutOfMemoryError",
    "gil_enabled" : null
  },
  "profile" : {
    "schema" : "lowlat-profile/1",
    "captured_at" : "2026-10-25T13:49:15Z",
    "host_label" : "bare-metal-host",
    "cpu" : {
      "vendor" : "Intel",
      "model" : "Intel 8-core/16-thread CPU",
      "sockets" : 1,
      "cores_per_socket" : 8,
      "threads_per_core" : 2,
      "logical_cpus" : 16,
      "smt_active" : true,
      "online" : "0-15",
      "caches" : {
        "l1d" : {
          "size_bytes" : 49152,
          "line_bytes" : 64
        },
        "l1i" : {
          "size_bytes" : 32768,
          "line_bytes" : 64
        },
        "l2" : {
          "size_bytes" : 1310720,
          "line_bytes" : 64
        },
        "l3" : {
          "size_bytes" : 25165824,
          "line_bytes" : 64
        }
      },
      "topology" : [ {
        "cpu" : 0,
        "core_id" : 0,
        "package_id" : 0
      }, {
        "cpu" : 1,
        "core_id" : 1,
        "package_id" : 0
      }, {
        "cpu" : 2,
        "core_id" : 2,
        "package_id" : 0
      }, {
        "cpu" : 3,
        "core_id" : 3,
        "package_id" : 0
      }, {
        "cpu" : 4,
        "core_id" : 4,
        "package_id" : 0
      }, {
        "cpu" : 5,
        "core_id" : 5,
        "package_id" : 0
      }, {
        "cpu" : 6,
        "core_id" : 6,
        "package_id" : 0
      }, {
        "cpu" : 7,
        "core_id" : 7,
        "package_id" : 0
      }, {
        "cpu" : 8,
        "core_id" : 0,
        "package_id" : 0
      }, {
        "cpu" : 9,
        "core_id" : 1,
        "package_id" : 0
      }, {
        "cpu" : 10,
        "core_id" : 2,
        "package_id" : 0
      }, {
        "cpu" : 11,
        "core_id" : 3,
        "package_id" : 0
      }, {
        "cpu" : 12,
        "core_id" : 4,
        "package_id" : 0
      }, {
        "cpu" : 13,
        "core_id" : 5,
        "package_id" : 0
      }, {
        "cpu" : 14,
        "core_id" : 6,
        "package_id" : 0
      }, {
        "cpu" : 15,
        "core_id" : 7,
        "package_id" : 0
      } ]
    },
    "power" : {
      "scaling_driver" : "intel_pstate",
      "governor" : "powersave",
      "energy_performance_preference" : "balance_performance",
      "intel_pstate_no_turbo" : false,
      "cpufreq_boost" : null,
      "cpu0_min_khz" : 800000,
      "cpu0_max_khz" : 4600000
    },
    "tuned" : "balanced",
    "kernel" : {
      "release" : "7.2",
      "version" : "PREEMPT_DYNAMIC",
      "preempt_model" : "PREEMPT_DYNAMIC",
      "realtime" : false,
      "sys_kernel_realtime" : null,
      "cmdline" : null,
      "isolcpus" : null,
      "nohz_full" : null,
      "rcu_nocbs" : null,
      "irqaffinity" : null,
      "sys_isolated" : null,
      "sys_nohz_full" : null
    },
    "clock" : {
      "current_clocksource" : "tsc",
      "available_clocksource" : [ "tsc", "acpi_pm" ]
    },
    "process" : {
      "pid" : 64973,
      "cpu_affinity" : "0-15",
      "sched_policy" : "SCHED_OTHER"
    },
    "virt" : {
      "type" : "none",
      "container" : "none"
    },
    "cgroup" : {
      "cpu_max" : "max 100000",
      "cpuset_effective" : null,
      "nr_throttled" : 0,
      "throttled_usec" : 0
    },
    "load" : {
      "load1" : 1.82,
      "load5" : 73.83,
      "load15" : 62.87,
      "running" : 1
    },
    "memory" : {
      "mem_total_kb" : 65545544,
      "hugepages_total" : 0,
      "hugepages_free" : 0,
      "hugepagesize_kb" : 2048,
      "transparent_hugepage" : "madvise",
      "thp_enabled" : "madvise",
      "thp_defrag" : "madvise",
      "thp_shmem_enabled" : "never"
    },
    "lab" : {
      "running_domains" : [ ]
    },
    "tools" : {
      "gcc" : "gcc (GCC) 16.2.1 20260819 (Red Hat 16.2.1-2)",
      "clang" : "clang version 22.1.8 (Fedora 22.1.8-4.fc44)",
      "java" : "openjdk version \"25.0.5\" 2026-10-20 LTS",
      "java_full" : "OpenJDK Runtime Environment Temurin-25.0.5+8 (build 25.0.5+8-LTS) | OpenJDK 64-Bit Server VM Temurin-25.0.5+8 (build 25.0.5+8-LTS, mixed mode, sharing)",
      "python3" : "Python 3.14.8",
      "cmake" : "cmake version 4.3.0",
      "perf" : "7.2",
      "valgrind" : "3.27.1",
      "perf_event_paranoid" : 2,
      "memlock_kb" : "8192"
    }
  },
  "notes" : "service; variant=worker-pool; open loop; rate_hz=5000; seconds=5; warmup_seconds=3; HTTP/1.1 on loopback; latency from the intended send time; dispatcher lateness (start of dispatch minus intended time)"
}
