{
  "schema": "lowlat-report/1",
  "example": "08-zero-copy-flat",
  "language": "java",
  "variant": "flat-ffm",
  "unit": "ns",
  "count": 142929,
  "dropped": 0,
  "percentiles": {
    "p50": 16,
    "p90": 17,
    "p99": 21,
    "p99_9": 53,
    "max": 78
  },
  "hdr_histogram": "HISTFAAAAGR4nJNpmSzMwMDgxAABzFCakYGB2c1gxwIG+w8QAdlfLPeucPdMZj2icYK5g+0G2xLGECkjOSkpMREuIS4WJiZGNkYmZiYmJkYmpnmMzxjfMP9incdYZsTDwcYKEhdlAgDRtRKt",
  "build": {
    "compiler": "Java 25.0.5 OpenJDK 64-Bit Server VM 25.0.5+8-LTS; JMH 1.37",
    "gil_enabled": null,
    "flags": "--enable-native-access=ALL-UNNAMED"
  },
  "profile": {
    "schema": "lowlat-profile/1",
    "captured_at": "2026-10-23T00:47:14Z",
    "host_label": "bare-metal-host",
    "cpu": {
      "model": "11th Gen Intel(R) Core(TM) i7-11800H @ 2.30GHz",
      "sockets": 1,
      "cores_per_socket": 8,
      "threads_per_core": 2,
      "logical_cpus": 16,
      "smt_active": true,
      "online": "0-15"
    },
    "power": {
      "scaling_driver": "intel_pstate",
      "governor": "powersave",
      "energy_performance_preference": "balance_performance",
      "intel_pstate_no_turbo": false,
      "cpufreq_boost": null,
      "cpu0_min_khz": 800000,
      "cpu0_max_khz": 4600000
    },
    "tuned": "balanced",
    "kernel": {
      "release": "7.2.11-200.fc44.x86_64",
      "version": "#1 SMP PREEMPT_DYNAMIC Thu Oct 15 15:58:58 UTC 2026",
      "preempt_model": "PREEMPT_DYNAMIC",
      "realtime": false,
      "sys_kernel_realtime": null,
      "cmdline": null,
      "isolcpus": null,
      "nohz_full": null,
      "rcu_nocbs": null,
      "irqaffinity": null,
      "sys_isolated": null,
      "sys_nohz_full": null
    },
    "clock": {
      "current_clocksource": "tsc",
      "available_clocksource": [
        "tsc",
        "acpi_pm"
      ]
    },
    "process": {
      "pid": 2479234,
      "cpu_affinity": "0-15",
      "sched_policy": "SCHED_OTHER"
    },
    "virt": {
      "type": "none",
      "product_name": "XPS 15 9510"
    },
    "load": {
      "load1": 1.52,
      "load5": 0.92,
      "load15": 0.82,
      "running": 1
    },
    "memory": {
      "mem_total_kb": 65545544,
      "hugepages_total": 0,
      "hugepages_free": 0,
      "hugepagesize_kb": 2048,
      "transparent_hugepage": "madvise",
      "thp_enabled": "madvise",
      "thp_defrag": "madvise"
    },
    "lab": {
      "running_domains": []
    },
    "tools": {
      "gcc": "gcc (GCC) 16.2.1 20260819 (Red Hat 16.2.1-2)",
      "clang": "clang version 22.1.8 (Fedora 22.1.8-4.fc44)",
      "java": "openjdk version \"25.0.5\" 2026-10-20 LTS",
      "java_full": "OpenJDK Runtime Environment Temurin-25.0.5+8 (build 25.0.5+8-LTS) | OpenJDK 64-Bit Server VM Temurin-25.0.5+8 (build 25.0.5+8-LTS, mixed mode, sharing)",
      "python3": "Python 3.14.8",
      "cmake": "cmake version 4.3.0",
      "perf_event_paranoid": 2,
      "memlock_kb": "8192"
    }
  },
  "notes": "JMH SampleTime, 2 forks x 5 iterations of 500 ms; samples are invocations divided by @OperationsPerInvocation, rounded to whole ns",
  "runtime": {
    "alloc_bytes_per_parcel": 0.0012604093647199076
  }
}
