{
  "schema" : "lowlat-report/1",
  "example" : "07-offheap-lockfree",
  "language" : "java",
  "variant" : "write-per-parcel-divert",
  "unit" : "ns",
  "count" : 200000,
  "dropped" : 0,
  "percentiles" : {
    "p50" : 4855,
    "p90" : 7707,
    "p99" : 12855,
    "p99_9" : 64991,
    "max" : 2146303
  },
  "hdr_histogram" : "HISTFAAACYx4nEVVDWgV2RWee+6dO/fNmzeZTF4mL8/xbTarWZt1d1Pr/lZca0XsstjFLpJa2VoRm9qwXWwRa7dLakMaRFJJUwkiIQQrIlYkiAQRCSHYsEgIQUSCLFZCEJEQrITFBul37rylbzJz7z33/HznN2n33+ocJ/zAyX6yugpst7eNDTsfLGWEf79JvyCPauh1cqhApMkEQZRGxY2Vddt27Oq8Ii6IM2JWfCNeiEVaoSfynjyppt1ufU4PeUNm0jzPjfiTwdXgdOFcuFRzs7a3dqpuue5icb74df2VhrnkcsPpxsulidKNxpnGR+UXjSur5lbdKH+VLqc96cjqS6tPVbrSwXRg9YtVc+m18sCq+fLDUm+5r3Sz4XrDUMNQMlW/UnxStxzPxn3xo+h67f2a5ZrFmuM1d2pGw8vhUqGvMFGYK0wHfYXRfHf+bn4+P5kf88f9Z7mx3IB/1wzmxnMjuTmz4F3MjZve3IxZ9O6acW/Jm/QWvLvekPdAH/eGvWU94J3Sj/SQHtFdeskddWfdp26Xfqx63B530J1yV9QjNa5uqyvqhDqtVuRdOScX5FM5Ki/LW9ityDF5Qc7IO3hXaER2y375hO7LAXleTslheRsSE3IE8ZtQz+R59ULeVyfcJXUHFm6pa+49d9Kdcafd2+6A7ncX3LvuhHtcn9Jn9LTb5Q658+qm+0jdUKOq1z735WNYH1aTclzOw/pFdUFNqWH1UJ1TV90z0Lfk3nHPug+g67Z7HpSHakaddMdw/1zel7fUMCSH5Twt0yLdoz66SGM0QI/FiuijWTGPtZueYB0T02IRTzctoBZm7e449eBZFM9FF90Td2iITtIV6sU6TtfpMnXTKJ2hfuxH6BQti/P0jThJ5+gETvfB1U+n6Tx4JsDxEDKjdAnyU7A/Sws0STfANUxX6Rqee/QVXcD+It5RekBd0DmA9xwkRqDxLHSeAccAEDGCb4DvEmzOiQdiWSyJHnomnooFnGfFNXEW/kzhHRNXRLc4JU6IY/1i/5c94kC/+HTnsU8/P/Lxh/u3du75ZO/GLdt379754e6d72/d3rbj/fZdW979qL19w76d2/Zu2r7v4KEDB48e6hHHRee+L4dFnxgSJ8Wg6BeXYOS2GBVXYeKmmICZiziPiFtiHMZ7xDB4BsWXA+LYGXFs77GjXeJg+5YDew4e2b/ncEfnJ7sOt7fvOLzjw517tu/Z/PaGLds2rW/Z+G7auiZNmzauSSutbetbm0tpc9KyrlJq3ZAma5qb0zSpNCUVPOVSuVRJS0FUrOg3SlG5KS0GOmwqmdSAFEZxSUdR2Zg49MM4TqLYREEUR7GPxvdDXQ5DP/ADfIIg9iM/1joOosQPjA7AH0UGXMWgGBpwRHE5iCM/iMIQMkEYBX5UjENw4Zww0TfFWMVxCXdRWPS1b0IVxmANocdEsY5M7IemkiZBWE5KkR+GxVISJnEljprXJDBYjsLIL5cBMzFpEpYAP1bFpBgDVjmO0zQOw0pYLAJMHMRFGA+BwLBPwAbuEiOOosg3qqh8o+E3LMKShk+hNoEJfcAwoTG4jSINYEoTKWO0MSp0FClylFZaq0ApXrQKySijHZ9YzDVKYXLqINLkax0GhpSjfMI4VTDmQIaZodA4uJe4hk4DE8o4BjpgThvWCJqVwqXWzGYCBeCkI1/5bBhU4yvCFdmjQxkeqAMFOGCMDEjwCSIKJDhqmATjSvsEXMwOazhpFQXamsIX3pEfWOMEYdjyFWQdsEOU2AdlkFGHeYEa+EFwlGQcrNAC0y4REDsIGcfQAUSwQ4lLEnoowBlASCKUyiHrE641/qxb5GiJGChWYMMAHpCVJB9K+QaMTFKczCwz7AyDgawPL5JSU8sbrRs++mj34T5xrGME/8O4Bb9CY85jGgxiTgxhOlzHZJmiLvkAU2WRBuQLekFXMBfPyuc0hZn9FHP9ESb3dXlcLWC+X5U3ZJeaxTojH4J3FDfLmF0n5GOap9PyDk1jnabbmD1X8ayIZ/i/+TVm0AwmzwTafx5j4AKGwii+veLoIGZGr+jC3Og80is6usQXnT3ii6Odvzuyv2N/R+fRzzs6Oz777OjeAx/v27Xn0472Q58d2rR1045tm9/fvLN18xttGzZvfLtl3ea317+7fn3zutZya9rS1rImaWtLWlqSqBI3rWkqJqVK0oyJEKJLiqWSikpRqWyiMIn8YhT6keEeR+Ny2UZhquNIoTe4S9AZPrKtwiBQWPFD26AKDRcLt4PhvKGfVRBFSAqO2c9w9fhIkq0aLg3lQBr1xlXKVYiqRV0otA+rsgzgNirHGZSoFE0eKgE1wvm2t/jL2cKwhYPi4IrAh3lce40/bCTfS+4DlgRFObaWtNRcfto2mK0zyprGNrfD5aS0y5YsoKpCrkYuQMeWoGazklss4+ArbmLK6pNtVzE7KHT7sqNwkvmMRIOAzTZfwFfoI9jmmLJmw33PMcSQ5EaSdhJkliCvPIDLh7a/pA0Jg+MOZIfZa2uNHyi1BATSNpvHBKuJx5q2LjjksuasedktviOmKk6AtWnxZ9bZpM4IPGFI2r1rcwBorOnbLFgm16aowAkAPU/1vLMEZspzzD0Iu1YRAHl2m2mFNki8ZE17lLPqoU9hZxVKWgtFsFdLtdDhWXSuqse3hrcQYX8a6DViHgfUtZb2MtQ2gN/JMHnMW2eNYlPLmtX/MXGm6/mAuilgzVddY6k80SqyYSLruoR6e9EIxpx9X6PVFnwjLK5VmYLVFukHoNdCpWMded3aszpU3bdll9UZx8VeWTFPe7Z2s6gDFlXTIJWVZo/sjM1lZEtVWUdY2Ggsh3KqkCXHxpy1czxUnv3HL6fYbA10fFvOFmhW3ADCUcxbCRtYh6pd4iHBltHCqKVM83c4Q9XyLVTjym+95amHtpesZ1wd+DaAnLe5BOFNVQNSwcbKrWa0kV7BQ68APgf6t7agJFKYQzocMEo7CjBGVtkseDYDVTBrVZY7do4lqngKtlIksLJfVsSmv7Ga7louv3pbwV4WEm6nLMwFW2EuWTTcUg3QzglpsIw565uNi2uhraVqyDNSgfMBzY2qVv3Ylgv9yCrg6Hj0B7C9iv079Jat3R9g9ej7cPVX9GeBw6/pjxAo0F+4yv9D9Ev6r6C/Er0Hhr8TwPyDILQaKn+G72/A9Bb9FFH7k6B/CZRhjn5C34VfdSjCV8HewGGn74H2Gjx6GaefA2UDQvMO7msA/U36IaTeA8fvIfXPhP4HVCkISw==",
  "build" : {
    "compiler" : "OpenJDK 25.0.5+8-LTS (OpenJDK 64-Bit Server VM)",
    "flags" : "-Xlog:async -Xlog:gc*,safepoint:file=/home/rsedor/Dev/low-latency-engineering/examples/07-offheap-lockfree/results/r02-run2/write-per-parcel.gc.log:uptime,level,tags -Xms1g -Xmx1g -XX:+AlwaysPreTouch -XX:+UseG1GC -Dchronicle.analytics.disable=true --add-exports=java.base/jdk.internal.misc=ALL-UNNAMED --add-exports=java.base/jdk.internal.ref=ALL-UNNAMED --add-exports=java.base/jdk.internal.util=ALL-UNNAMED --add-exports=java.base/sun.nio.ch=ALL-UNNAMED --add-exports=jdk.compiler/com.sun.tools.javac.file=ALL-UNNAMED --add-exports=jdk.unsupported/sun.misc=ALL-UNNAMED --add-opens=java.base/java.io=ALL-UNNAMED --add-opens=java.base/java.lang=ALL-UNNAMED --add-opens=java.base/java.lang.reflect=ALL-UNNAMED --add-opens=java.base/java.util=ALL-UNNAMED --add-opens=jdk.compiler/com.sun.tools.javac=ALL-UNNAMED --enable-native-access=ALL-UNNAMED",
    "gil_enabled" : null
  },
  "profile" : {
    "schema" : "lowlat-profile/1",
    "captured_at" : "2026-10-23T00:19:50Z",
    "host_label" : "bare-metal-host",
    "cpu" : {
      "model" : "11th Gen Intel(R) Core(TM) i7-11800H @ 2.30GHz",
      "sockets" : 1,
      "cores_per_socket" : 8,
      "threads_per_core" : 2,
      "logical_cpus" : 16,
      "smt_active" : true,
      "online" : "0-15"
    },
    "power" : {
      "scaling_driver" : "intel_pstate",
      "governor" : "powersave",
      "energy_performance_preference" : "balance_performance",
      "intel_pstate_no_turbo" : false,
      "cpufreq_boost" : null,
      "cpu0_min_khz" : 800000,
      "cpu0_max_khz" : 4600000
    },
    "tuned" : "balanced",
    "kernel" : {
      "release" : "7.2.11-200.fc44.x86_64",
      "version" : "#1 SMP PREEMPT_DYNAMIC Thu Oct 15 15:58:58 UTC 2026",
      "preempt_model" : "PREEMPT_DYNAMIC",
      "realtime" : false,
      "sys_kernel_realtime" : null,
      "cmdline" : null,
      "isolcpus" : null,
      "nohz_full" : null,
      "rcu_nocbs" : null,
      "irqaffinity" : null,
      "sys_isolated" : null,
      "sys_nohz_full" : null
    },
    "clock" : {
      "current_clocksource" : "tsc",
      "available_clocksource" : [ "tsc", "acpi_pm" ]
    },
    "process" : {
      "pid" : 2463169,
      "cpu_affinity" : "0-15",
      "sched_policy" : "SCHED_OTHER"
    },
    "virt" : {
      "type" : "none",
      "product_name" : "XPS 15 9510"
    },
    "load" : {
      "load1" : 1.18,
      "load5" : 0.98,
      "load15" : 0.9,
      "running" : 1
    },
    "memory" : {
      "mem_total_kb" : 65545544,
      "hugepages_total" : 0,
      "hugepages_free" : 0,
      "hugepagesize_kb" : 2048,
      "transparent_hugepage" : "madvise",
      "thp_enabled" : "madvise",
      "thp_defrag" : "madvise"
    },
    "lab" : {
      "running_domains" : [ ]
    },
    "tools" : {
      "gcc" : "gcc (GCC) 16.2.1 20260819 (Red Hat 16.2.1-2)",
      "clang" : "clang version 22.1.8 (Fedora 22.1.8-4.fc44)",
      "java" : "openjdk version \"25.0.5\" 2026-10-20 LTS",
      "java_full" : "OpenJDK Runtime Environment Temurin-25.0.5+8 (build 25.0.5+8-LTS) | OpenJDK 64-Bit Server VM Temurin-25.0.5+8 (build 25.0.5+8-LTS, mixed mode, sharing)",
      "python3" : "Python 3.14.8",
      "cmake" : "cmake version 4.3.0",
      "perf_event_paranoid" : 2,
      "memlock_kb" : "8192"
    }
  },
  "notes" : "handoff=agrona_busy_spin; journal=file; manifest=none; published=200000; overflow=0; divert_received=200000; reordered=0; rcvbuf_granted=4194304; slots=65536; placement=unpinned; journal_fs=btrfs; journal_bytes=8000000; journal_readback_count=200000; journal_in_order=true; old_gen_baseline_bytes=3797064",
  "runtime" : {
    "gc" : {
      "collectors" : [ "G1 Young Generation", "G1 Concurrent GC", "G1 Old Generation" ],
      "heap_bytes" : 1073741824,
      "flags" : [ "-Xlog:gc*,safepoint:file=/home/rsedor/Dev/low-latency-engineering/examples/07-offheap-lockfree/results/r02-run2/write-per-parcel.gc.log:uptime,level,tags", "-Xms1g", "-Xmx1g", "-XX:+AlwaysPreTouch", "-XX:+UseG1GC" ]
    }
  }
}
